{"schema_version":1,"event_id":"meta_leadgen_555000111222334","source":"meta_lead_ads","mode":"shadow","leadgen_id":"555000111222334","page_id":"1039357632750262","form_id":"1280816026986939","ad_id":null,"adgroup_id":null,"created_time":null,"received_at":"2026-10-14T10:00:05.123Z","lead":{"id":"555000111222334","created_time":null,"form_id":"1280816026986939","ad_id":null,"campaign_name":null,"field_data":[{"name":"email","values":["solo.email@example.com"]}]}}
